{
  "$schema": "../../../schemas/executable-test.schema.json",
  "id": "ETS-REVIT-TEMPLATE-CONTENT-001-REVIT",
  "type": "executable_test",
  "title": "Revit/ZEN project-template content check",
  "status": "migration_candidate",
  "system_role": "conformance",
  "modules": ["S3", "S4", "S8"],
  "ats_id": "ATS-REVIT-TEMPLATE-CONTENT-001",
  "implementation_binding": {
    "platform": "Autodesk Revit",
    "executor": "ZEN",
    "implementation_class": "api_checker",
    "supported_versions": ["2024", "2025", "2026", "2027"],
    "callable_reference": null
  },
  "implementation_state": "specified_not_implemented",
  "input_contract": {
    "subject": "A governed Revit project template or project aligned to a governed template release.",
    "required_governance_inputs": ["Template Catalogue entry", "governed template-content manifest", "template validation ruleset", "approved exceptions"],
    "preconditions": ["The template/project is readable through an approved Revit API execution context.", "Its governed template identity/release can be resolved or explicitly marked unresolved."]
  },
  "execution_contract": {
    "steps": ["Resolve the tested template identity and governed release context.", "Enumerate required content classes including titleblocks, view templates, annotation styles, object/line styles, materials, phases, worksets where applicable, and governed parameters.", "Compare the observed inventory to the governed content manifest and validation ruleset.", "Record missing, obsolete, duplicate, unauthorized substitute, and unresolved content.", "Map findings to ATS result states."],
    "safety_boundary": "Read-only. The checker shall not load, purge, rename, replace, or repair template content.",
    "authority_boundary": "The ETS verifies a governed template release; it cannot designate a template as approved or alter the Template Catalogue."
  },
  "evidence_output_contract": {
    "schema": "schemas/conformance-result.schema.json",
    "required_observations": ["tested template identity/release", "required content count", "missing content count", "obsolete/unauthorized content count", "unresolved manifest count", "finding records by content class and identifier"],
    "retained_artifacts": ["machine-readable template conformance result", "template content delta inventory"]
  },
  "result_mapping": {
    "pass": "The governed template identity is resolved and the complete applicable content manifest is satisfied without unauthorized substitutions.",
    "fail": "A complete applicable manifest exists and at least one required item is missing, obsolete, or replaced by unauthorized local content.",
    "not_applicable": "No governed Revit template applies to the tested context.",
    "indeterminate": "The governed Template Catalogue, content manifest, validation ruleset, or template identity is incomplete or unavailable."
  },
  "provenance": {"source_system":"repository_curator","derived_from":"ATS-REVIT-TEMPLATE-CONTENT-001","migration_note":"Appendix E Revit/ZEN ETS contract. It remains specification-only until concrete governed template catalogue/manifest data exists."}
}
