{
  "$schema": "../../../schemas/executable-test.schema.json",
  "id": "ETS-REVIT-NAMING-001-REVIT",
  "type": "executable_test",
  "title": "Revit/ZEN governed object naming check",
  "status": "migration_candidate",
  "system_role": "conformance",
  "modules": ["S4"],
  "ats_id": "ATS-REVIT-NAMING-001",
  "implementation_binding": {
    "platform": "Autodesk Revit",
    "executor": "ZEN",
    "implementation_class": "api_checker",
    "supported_versions": ["2024", "2025", "2026", "2027"],
    "callable_reference": null
  },
  "implementation_state": "specified_not_implemented",
  "input_contract": {
    "subject": "A governed Revit document and the set of object classes selected for naming validation.",
    "required_governance_inputs": ["applicable S4 naming syntax", "controlled vocabulary for each tested naming surface", "approved naming exceptions"],
    "preconditions": ["The document is readable through an approved Revit API execution context.", "Each tested object class can be mapped to an available governed naming surface."]
  },
  "execution_contract": {
    "steps": ["Enumerate applicable governed Revit objects and record object class, stable identifier, and current name.", "Resolve the governed syntax/vocabulary for each object class.", "Parse each name against token order, delimiter, vocabulary, and identity rules.", "Record violations, ambiguities, duplicates, and objects whose governing vocabulary is unavailable.", "Map findings to ATS result states without deriving new naming authority."],
    "safety_boundary": "Read-only. The checker shall not rename Revit objects or modify naming registries.",
    "authority_boundary": "The ETS tests conformance to governed S4/L6 rules; it cannot approve new names, tokens, or vocabularies."
  },
  "evidence_output_contract": {
    "schema": "schemas/conformance-result.schema.json",
    "required_observations": ["tested document identity", "object count by naming surface", "conforming object count", "violation count", "unresolved-governance count", "finding records with object id, object class, name, and failed rule where available"],
    "retained_artifacts": ["machine-readable naming conformance result", "naming finding inventory"]
  },
  "result_mapping": {
    "pass": "All applicable tested objects conform to complete governed naming rules and no unresolved governance input remains.",
    "fail": "At least one tested object positively violates an available governed naming rule.",
    "not_applicable": "No object in scope is governed by a naming rule.",
    "indeterminate": "One or more applicable object classes cannot be evaluated because the governing syntax or vocabulary is incomplete or unavailable."
  },
  "provenance": {"source_system":"repository_curator","derived_from":"ATS-REVIT-NAMING-001","migration_note":"Appendix E Revit/ZEN ETS contract. Not implemented until a callable and governed vocabulary inputs are available."}
}
